,Frutas,Precio Frutas,Verdura,Precio Verduras,Lacteos,Precio Lacteos,Carne,Precio Carnes,Enlatados ,Precio Enlatados
0,Platano 1 Kg,17.5,Tomate Huaje Supremo 1 Kg,18.5,Yogurt Fresa 0% 150 Gr,31.9,Molida Pulpa Negra De Res 500 Gr,112.0,Atun En Agua 140 Gr,19.5
1,Papaya Maradol 1 Kg,28.0,Aguacate Supremo 1 Kg,51.0,Yogurt Griego Natural 150 Gr,31.9,Molida London Broil De Res 500 Gr,123.0,Atun En Agua 140 Gr,20.0
2,Sandia Sangria 1 Kg,13.0,Papa Blanca 1 Kg,41.0,Yogurth Griego Chobani Core Cereza 150 Gr,31.9,Molida Pulpa Fina De Res 300 Gr,62.0,Frijoles Refritos Bayos 400 Gr,15.9
3,Naranja Valencia 1 Kg,16.0,Cebolla Bca Limpia 1 Kg,17.5,Yoghurt Griego Core Frambuesa 150 Gr,31.9,Molida Sirloin De Res 300 Gr,64.0,Frijoles Refritos Peruanos 400 Gr,15.9
4,Melon Chino 1 Kg,24.0,Limon Agrio Supremo 1 Kg,38.0,Yoghurt Griego Core Vainilla 150 Gr,31.9,Pechuga De Pollo S/H 1 Kg,144.0,Elote En Lata 220 Gr,10.0
5,Fresa 1 Lb 454 Gr,77.9,Nopal Limpio 1 Kg,31.0,Yogurt Griego Fresa Y Platano 150 Gr,31.9,Milanesa Natural De Pollo Paq.De.550Gr 550 Gr,89.5,Elote En Lata 432 Gr,15.0
6,Jicama Gde 1 Kg,19.5,Cilantro Manojo,7.0,Leche Condensada 387 Gr 397 Gr,24.0,Milanesa De Pulpa Negra 1 Kg,226.0,Atun En Agua Solido De Lomo 140 Gr,31.9
7,Manzana Golden Saltillo Bin 1 Kg,36.0,Zanahoria 1 Kg,15.0,Leche Evaporada Regular 360 Gr,17.0,Filete De Mojarra De Granja Prev. Cong. 1 Kg,110.0,Atun En Agua Pouch 75 Gr,19.0
8,Pina Miel Gold,57.0,Calabacita 1 Kg,24.0,Leche Almendras Original 1.89 Lt,64.0,Pierna Y Muslo De Pollo Iqf 1 Kg,27.0,Atun En Agua 140 Gr,12.0
9,Manzana Golden Nacional 1 Kg,36.0,Elote Blanco,7.0,Queso Panela 400 Gr,78.9,Pechuga De Pollo Deshuesada 1 Kg,143.0,Frijoles Pintos 425 Gr,18.9
10,Manzana Gala Imp 1 Kg,62.0,Pepino Fresco 1 Kg,20.5,Fermentados Natural 400 Gr,32.9,Molida Clásica De Res 1 Kg,153.0,Atun En Aceite 140 Gr,20.0
11,Mango Ataulfo Supremo 1 Kg,46.0,Espinaca Manojo,7.0,Leche Uht Deslactosada Light 1 Lt,24.5,Muslo De Pollo Paq.Reg. 1 Kg,68.9,Elote En Lata 225 Gr,9.0
12,Sandia Roja Sin Semilla 1 Kg,13.0,Lechuga Romana,16.0,Leche Uht Deslactosada Light 1 Lt,24.0,Fajita De Pollo 1 Kg,144.0,Elote En Lata 220 Gr,9.0
13,Manzana Golden En Bsa Nacional1.34 1.36 Gr,45.0,Limon S/Semilla 1 Kg,20.5,Huevo Blanco Mediano 30 Pz,56.0,Alco Milanesa Corazon 170 Gr. 170 Gr,31.0,Sopa Fideo 95 Gr,13.0
14,Pera D Anjou 1 Kg,65.5,Tomate Bola Supremo 1 Kg,17.5,Leche Uht 100 Proteina Reducida Grasa 1 Lt,28.0,Pierna Con Muslo De Pollo Corte Americano Fres 1 Kg,27.0,Frijoles Refritos Bayos 400 Gr,13.9
15,Manzana Red Delicious Imp Suprema 1 Kg,51.9,Brocoli Coronas 1 Kg,33.9,Mantequilla Barra Con Sal 90 Gr,14.0,Pechuga De Pollo C/H S/Piel Empacada 1 Kg,145.0,Atun Jumbo En Agua 295 Gr,40.0
16,Uva Blanca S/S Suprema 1 Kg,104.0,Lechuga Orejona,17.5,Leche Uht Deslactosada 1 Lt,24.5,Pechuga Entera C/H De Pollo Bolsa 1 Kg,109.0,Atun Pouch Agua 74 Gr,21.5
17,Manzana Golden En Bolsa 600 G,19.0,Chayote Sin Espinas 1 Kg,36.0,Crema Liquida Regular 450 Ml,33.5,Pierna De Cerdo C/H Rebanada 1 Kg,82.0,Atun En Agua 130 Gr,20.0
18,Manzana Golden Imp Suprema 1 Kg,73.0,Tomatillo Limpio Season Select,17.5,Yogurt Griego Natural 150 Gr,19.5,Muslo S/Rs/Piel Empacado 1 Kg,83.0,Atun Agua 295 Gr,41.0
19,Toronja Sangria 1 Kg,19.5,Papa Blanca Chica 1 Kg,36.0,Leche Uht Deslactosada Semidecremada 1Lt 1 Lt,24.0,Molida De Res 95/5 400 Gr,73.0,Frijoles Refritos Negros 400 Gr,15.9
20,Manzana Golden De Saltillo 900Gr,31.0,Coliflor Blanca Pza,36.0,Leche Uht Deslactosada 1.5Lt 1.5 Lt,35.0,Filete De Mojarra Natural 1 Kg,153.0,Atun Pouch Agua 78 Gr,20.5
21,Blueberry 170 Gr,55.0,Cebolla Cambray,10.0,Queso Chihuahua Menonita 550 Gr,97.0,Chuleta Ahumada Paq. Fam 1 Kg,93.0,Atun En Agua Pouch 74 Gr,16.0
22,Guayaba Suprema 1 Kg,29.9,Acelga Verde,7.0,Fermentados Sin Azucar Pack 400 Gr,35.9,Pechuga C/H De Pollo 1 Kg,109.0,Elote En Lata 400 Gr,15.0
23,Frambuesa 170 Gr,55.0,Seasons Select Aguacate Malla,38.0,Leche Uht Light 1 Lt,22.9,Aguja Norteña C/H De Res 1 Kg,215.0,Frijoles Bayos Refritos 430 Gr,15.5
24,Platano Macho Gde 1 Kg,28.0,Tomate Fresadilla 1 Kg,15.0,Leche Almendras Vainilla Sin Azucar 1.89 Lt,64.0,Milanesa De Pollo Premium 500 Gr,103.0,Sopa Ramen De Pollo 85 Gr,6.0
25,Naranja En Malla 2 Kg,33.9,Champinon Bco Reb De 225,23.0,Leche Uht Entera 1Lt 1 Lt,23.0,Carne De Res Sin Hueso P/Cocido 1 Kg,174.0,Sopa Fideo 143 Gr,17.5
26,Kiwi 1 Kg,103.0,Chile Poblano 1 Kg,31.0,Leche Uht Light 1Lt 1 Lt,23.0,Costilla Norteña S/H De Res 1 Kg,195.0,Elote Blanco En Lata 220 Gr,14.9
27,Mango Manililla 1 Kg,41.0,Apio 1 Kg,20.5,Leche Uht Deslactosada Entera 1 Lt,24.0,Filete Tilapia Granja Grande 1 Kg,153.0,Piña Trocitos En Almibar 800 Gr,47.0
28,Manzana Granny Smith Gde Imp 1 Kg,83.0,Pimiento Semaforo C/3,46.0,Leche Entera 1 Six 6 Lt,128.0,Heb Fajitas De Pechuga De Pollo Bolsa De 1 Kg,135.0,Sopas Knorr Sopa Estrellitas 143 Gr,17.5
29,Sandia Bambino 1 Kg,22.0,Limon Amarillo ( Variedad Eureka) 1 Kg,62.0,Queso Rallado Mezcla Mexicana 300 Gr,78.9,Milanesa Marinada D/Pollo Paq.De 550 Gr,89.5,Frijoles Peruanos Refritos 400 Gr,13.9
30,Zarzamora 170 Gr,51.9,Mini Floretes De Brocoli,20.5,Yogurt Griego Natural 145 Gr,9.0,Brisket De Res 1 Kg,205.0,Frijoles Refritos Bayos 580 Gr,13.0
31,Uva Roja S/S Suprema 1 Kg,104.0,Perejil Liso,13.5,Formula Lactea Two Pack 2 Lt,34.0,Deshebrada De Pulpa Negra 1 Kg,215.0,Piña Rebanadas En Almibar 800 Gr,47.0
32,Durazno Importado 1 Kg,70.0,Tomatillo Limpio 1 Kg,19.5,Mantequilla Sin Sal 90 Gr,18.0,Bistec S/H Para Asar De Res Supreme 1 Kg,164.0,Pimiento Morron En Tiras 200 Gr,17.0
33,Blueberrie Clam 510 Gr 170 Gr,130.0,Chile Serrano 1 Kg,19.5,Leche Uht Entera 1.5 Lt,32.5,Milanesa De Pollo Congelada Bolsa 750 Gr,123.0,Chiles Chipotles Adobados 105 Gr,12.0
34,Papaya Royal Star 1 Kg,39.0,Aguacatito En Malla,26.0,Huevo Blanco 18 Pz,55.0,Molida De Res 90/10 400 Gr,65.0,Atun Agua Pouch 180 Gr,45.0
35,Mango Manila 1 Kg,51.0,Esparrago 1Lb 1 Lb,72.0,Yogurt Griego Natural 907 Gr,78.0,Molida Pulpa De Res 1 Kg,195.0,Sopa Letras 95 Gr,13.0
36,Melon Valenciano 1 Kg,31.0,Cebolla Morada 1 Kg,24.0,Huevo Mediano Mt 30 Pz,56.0,Filete De Mojarra Granja En Bolsa 900 Gr,107.0,Sopas Knorr Sopa Letras 143 Gr,17.5
37,Platano Dominico 1 Kg,46.0,Repollo Verde 1 Kg,14.0,Huevo Blanco Jumbo Con Vitamina E 30 Pz,75.0,Molida De Cerdo 1 Kg,93.0,Sopa De Pollo Con Verduras 64 Gr,12.0
38,Cereza Clam 1 250 Gr,73.0,Chile Jalapeño 1 Kg,15.0,Yogurt Griego Batido Natural Sin Azucar 145 Gr,11.0,Milanesa De Pulpa Blanca 1 Kg,205.0,Garbanzo Al Natural 400 Gr,16.0
39,Toronja En Malla De 2.5K 2.5 Kg,46.0,S S Limon Agrio En Malla 1.5 Kg,54.5,Media Crema 225 Gr,15.0,Molida De Res 80 / 20 400 Gr,52.0,Elote En Lata 400 Gr,14.9
40,Pera Bosc 1 Kg,75.9,Pimiento Verde 1 Kg,51.0,Margarina Untable Con Sal 425 Gr,24.0,Lomos De Salmon Prev. Cong. 1 Kg,380.0,Sopa Municiones 95 Gr,13.0
41,Piña Miel Suprema,62.0,Champinon Bco Entero De 225 Gr,23.0,Leche Uht Light 1 Lt,17.0,Cortadillo De Sirloin P/Guisar 1 Kg,195.0,Chiles Jalapeños Rajas 340 Gr,20.0
42,Uva Globo Roja 1 Kg,104.0,Lechuga Morada (Sangria) Nal,13.0,Crema Liquida Regular 320 Gr,18.0,Carbon Mezquite De 3 Kg,66.0,Sopa Estrellas 115 Gr,16.5
43,Naranja En Malla 5 Kg,77.0,Ajo Seasons Select Ajo 4Pzas,46.0,Leche Uht Entera 1Lt 1 Lt,17.0,Carne De Res Deshebrada 300 Gr,108.0,Atun En Agua 130 Gr,18.0
44,Fresh Piña Cortada 1 Kg,98.0,Betabel Rebotado 1 Kg,28.0,Huevo Blanco 30 Pz,82.0,Milanesa De Pulpa Bola 1 Kg,215.0,Frijoles Molidos 430 Gr,12.9
45,Toronja Ruby Red Rosa 1 Kg,24.0,Ajo En Malla,44.0,Huevo Blanco Mediano 12 Pz,35.9,Pierna Bate Blanca 1 Kg,72.0,Sopa De Camaron C/Limon Y Habanero 64 Gr,12.0
46,Fresh Jicama Cortada 1 Kg,49.0,Ejote Verde 1 Kg,51.0,Queso Panela Light 400Gr 400 Gr,81.0,Arrachera De Res Marinada 600 Gr,164.0,Garbanzo En Salmuera 440 Gr,19.5
47,Fruta Cortada Chico 300 Gr,24.0,Palitos De Apio Heb 400 Gr,29.0,Leche Light 1 Six 6 Lt,128.0,Top Sirloin 1 Kg,205.0,Chiles Jalapeños Rajas 240 Gr,12.5
48,Ciruela Roja Imp 1 Kg,70.0,Lechuga Italiana Nal,15.0,Queso Chihuahua Menonita Rallado 1 Kg,179.0,Milanesa De Pechuga Aplanada Charola 1 Kg,165.0,Sopa Ramen Carne De Res 85 Gr,6.0
49,Kiwi Dorado Clam C/3Pz,72.0,Floretes Brocoli En Bolsa 1Lb 454 Gr,23.0,Leche Evaporada 720 Gr,31.0,Pierna Bate S/Piel Empacado 1 Kg,83.0,Atun Bajo En Sodio 74 Gr,23.0
50,Uva Negra S/S 1 Kg,104.0,Champinon Bco Reb De 225 Gr,24.0,Leche Almendras Vainilla 1.89 Lt,64.0,Milanesa De Sirloin De Res 1 Kg,215.0,Garbanzo En Lata 425 Gr,14.0
51,Coco,20.5,Lechuga Hidroponica Francesa,31.0,Leche Uht 100 Proteina Semidesc 1 Lt,28.0,Carne De Cerdo Tipo Trompo 500 Gr,62.0,Frijoles Negros Refritos 400 Gr,13.9
52,Fresh Melon Cortado 1 Kg,65.0,Ensalada Lechuga Hidroponica Italiana,31.0,Leche Uht Sabor Vainilla 200 Ml,9.0,Sirloin C/H Para Asar 1 Kg,184.0,Atun Agua 285 Gr,40.0
53,Fresh Papaya Cortada 1 Kg,72.0,Champinon Cremini Reb De 225 Gr,23.0,Queso Panela Light 400Grs 400 Gr,75.0,Milanesa De Pulpa Negra Junior 1 Kg,246.0,Sopa Coditos 95 Gr,13.0
54,Mango Tommy 1 Kg,62.0,Tomate Cherubs 283 Gr,44.0,Huevo Blanco Mediano 18 Pz,38.0,Aguja Norteña C/H De Res 1 Kg,195.0,Atun En Aceite 140 Gr,19.5
55,Manzana Red En Bolsa 1.36 1.3 Kg,62.0,Cebolla Amarilla 1 Kg,28.0,Queso Amarillo Reb Chen 180 Gr,50.0,Fajita De Pechuga Natural 500 Gr,82.0,Atun En Aceite 130 Gr,20.0
56,Fresh Sandia Cortada 1 Kg,54.5,Camote Amarillo 1 Kg,48.0,Uht Deslactosada 6 Pack 6 Lt,133.0,Barrita Surimi Prev. Congelado 500 Gr,74.0,Chilorio De Cerdo Pouch 215 Gr,57.0
57,Tuna Roja 1 Kg,19.5,Vegetalistos Zanahoria Baby 340 Gr,23.0,Leche Uht Light 1 Lt,22.0,Chicharron Casero 70 Grs.,16.0,Macarron Con Queso 206 Gr,12.0
58,Melon Orangeflesh 1 Kg,31.0,Champinon Cremini De 225 Gr,23.0,Heb Queso Mozarella Rallado 454 Gr,125.0,Filete De Bacalao Desmigado S/Piel Bolsa 454 Gr,153.0,Frijoles Negros 560 Gr,13.6
59,Uva Blanca S/S Clam 1Lb,51.9,Tomate D Glory 283 Gr,44.0,Leche Organica Entera 1L 1 Lt,31.0,Salmon Ahumado Rebanado 113 Gr,117.0,Durazno Mitades En Almibar 820 Gr,48.0
60,Higo Clam,72.0,Papa Galeana 1 Kg,47.0,Queso Gouda 550 Gr,97.0,Salmon Ahumado Rebanado 226 Gr,210.0,Chilorio De Pavo Pouch 215 Gr,54.0
61,Uva Blanca Cotton Candy Sin Semilla 1 Kg,207.0,Cebolla De Rabo,12.0,Queso Oaxaca 400 Gr,96.0,Filete Bacalao S/Piel Y Espinas Cajita 454 Gr,256.0,Sopa Estrellas 95 Gr,13.0
62,Fruta Cortada Grande 600 Gr,46.0,Rabanitos En Manojo,19.0,Yogurt Natural Griego 125 Gr,13.9,Pulpo En Flor Mediano Prev. Congelado 1 Kg,277.0,Atun En Agua 295 Gr,43.0
63,Manzana Ambrosia 1 Kg,72.0,Pimiento Rojo 1 Kg,93.0,Leche Uht Entera 1 Lt,22.0,Salchicha Pepper Jack 369 Gr,82.0,Atun En Aceite Oliva 140 Gr,41.0
64,Manzana Braeburn 1 Kg,80.0,Jengibre 1 Kg,123.0,Gelatina Fresa 125 Gr,4.0,Salchicha Ahumada Original 369 Gr,75.0,Sopa Fideos Con Pollo 95 Gr,13.0
65,Granada Roja 1 Kg,103.0,Calabaza Criolla 1 Kg,48.0,Leche 100 Semidescremada 1 1 Lt,28.0,Salchicha Ahumada De Res 340 Gr,88.5,Frijoles Enteros Negros 454 Gr,15.5
66,Manzana Golden Imp En Bolsa 1.36,67.5,Vegetalistos Jicama Precortada 454 Gr,27.0,Yogurt Solido Natural 1 Kg,31.9,Salchicha Ahumada 3 Pepper 369 Gr,82.0,Chiles Jalapeños Rajas 105 Gr,8.0
67,Nectarina 1 Kg,70.0,Mezcla De Floretes Brocoli/Coliflor,25.0,Yogurt Bebible Fresa 242 Gr,10.0,Pechuga De Pollo En Tiras Pechuga De Pollo En Ti 700 Gr,153.0,Sopa Ramen C/ Camaron Habanero 85 Gr,6.0
68,Nectarina Blanca 1 Kg,83.0,Elote Amarillo Dulce,46.0,Crema Acida 426 Gr,32.9,Trozos De Pechuga Pimienta Limon Trozos De Pechu 700 Gr,116.0,Pure De Papa Instantaneo 160 Gr,20.5
69,Pera Red D Anjou 1 Kg,80.0,Chayote Con Espinas 1 Kg,23.0,Yogurt Bebible Fresa Deslactosado 250 Gr,8.0,Lomo Tocino & Pimenton 1 Kg,177.0,Champiñones Rebanados En Lata 186 Gr,13.0
70,Arandano Deshidratado 1 Kg,195.0,Vegetalistos Zanahoria Rallada 340 Gr,18.5,Leche Uht Sabor Fresa 200 Ml,9.0,Ensalada De Surimi 250 Gr,44.0,Lomo Atun Gourmet En Agua 140 Gr,32.9
71,Pera Asiatica Golden 1 Kg,72.0,Tomate Cherry Mr Lucky 280 Gr,33.9,Leche 100 Sin Lactosa Light 1 1 Lt,26.0,Ensalada De Surimi Tampico 250 Gr,44.0,Sopa De Res Con Verduras 64 Gr,12.0
72,Manzana Honey Crisp 1 Kg,86.0,Papa Blanca Malla 800 Grs,28.0,Yogurt Solido Natural 125 Gr,5.0,Harina Sazonado Picante 284 Gr,20.5,Frijoles Enteros Claros 454 Gr,15.5
73,Naranja Navel S/Semilla 1 Kg,51.0,Germinado De Soya 250 Gr,28.0,Yoghurt Griego Natural Sin Azucar 1 Kg,81.0,Harina Sazonada Limon 284 Gr,20.5,Atun En Aceite De Oliva En Pouch 85 Gr,26.0
74,Zarzamora 340 Gr,125.0,Tajin Chile Guajillo 75 Gr,36.0,Leche Uht Semidescremada 1 Lt,17.0,Harina Sazonada Para Pescado 284 Gr,20.5,Sopa Knorr Sopa Municiones Mas Pasta 24X115G 115 Gr,16.5
75,Ciruela Negra Imp 1 Kg,73.0,Corazon De Apio,22.0,Leche De Almendra Sin Azucar 946 Ml,45.0,Chicharron Estilo Carniceria 250Gr. 250 Gr,71.0,El Dorado Atun Atun En Agua 285 Gr,24.0
76,Manzana Gala Imp En Bolsa 1.36,65.5,Berenjena 1 Kg,72.0,Uht Lala 100 S/Lactosa Redu Gra Uht Lala 100 S/L 1 Lt,27.0,Ensalada Sierra Ahumada Al Chipotle 250 Gr,52.0,Base P/Pay 170 Gr,33.9
77,Maracuya 1 Kg,46.0,Champinon Bco Ent De 450 Gr,44.0,Yogurt Griego Vainilla 150 Gr,19.5,Ensalada Sierra Ahumada Natural 250 Gr,52.0,Sopa Ramen De Camaron 85 Gr,6.0
78,Pera Asiatica H 1 Kg,65.5,Zanahoria Baby Heb 400 Gr,40.0,Yogurt Doble Cero Beber Fresa 242G Ypt 242 Gr,11.0,Ensalada Sierra Ahumada Al Jalapeño 250 Gr,52.0,Elote En Lata 220 Gr,10.0
79,Caña De Azucar 1 Kg,15.0,Betabel Manojo,28.0,Mantequilla Con Sal 90 Gr,18.0,Salsa Coctelera Familiar,26.0,Champiñones Rebanados En Lata 186 Gr,17.0
80,Manzana Jonagold 1 Kg,80.0,Hongo Portabellini De 225 Gr,27.0,Queso Panela 400 Gr,72.0,Salsa Coctelera Picante,26.0,Frijoles Bayos Refritos 430 Gr,10.9
81,Ciruela Pasa Sin Hueso 1 Kg,184.0,Zanahoria Mediana En Bolsa 454 Gr,11.0,Lala Queso Panela Rebanado 300 Gr,58.0,Chorizo Chorizo Argentino 20 Cj,75.0,Durazno Trocitos En Almibar 425 Gr,27.0
82,Platano Manzano Gde 1 Kg,36.0,Champinon Jumbo De 500 Gr,51.0,Huevo Blanco 12 Pz,35.9,Chorizo Uruguayo Chorizo Uruguayo 500 Pz,89.5,Sopa De Camaron C/Chile Y Limon 64 Gr,12.0
83,Uva Pasa 1 Kg,103.0,Bits De Coliflor,41.0,Gelatina Uva 125 Gr,4.0,Hamburguesa De Atun 2 Pack 200 Gr,37.0,Atun En Agua Pouch 85 Gr,19.5
84,Manzana Fuji Gde Imp 1 Kg,72.0,Floretes De Coliflor 454 Gr,20.5,Leche Evaporada Light 360 Gr,17.0,Medallon De Atun Rojo Pza 200 Gr,71.0,Atun Aceite 295 Gr,41.0
85,Tejocote 1 Kg,46.0,Lechuga Orejona Roja Pza,13.0,Crema Liquida Regular 233 Gr,15.0,Cabrito Para Asar De 4.2 A 4.5 Kg.,1545.0,Ensalada Atun Light 135 Gr,18.0
86,Melon Canary 1 Kg,10.0,Mini Flakes De Coliflor,31.0,Yogurt Bebible Con Fruta Fresa 220 Gr,9.0,Boneless Lemon & Pepper 700 Gr,151.0,Zanahorias En Escabeche 230 Gr,10.0
87,Mamey Gde 1 Kg,46.0,Lechuga Hidroponica Trio Mix,29.0,Queso Oaxaca Light 500 Gr,99.0,Fajitas De Atun 350 Gr,106.0,Frijoles Bayos Refritos Bajos En Grasa 430 Gr,10.9
88,Toronja Marss White 1 Kg,24.0,Zanahoria Seleccionada Charola1Lb,13.0,Mantequilla Untable Con Sal 250 Gr,73.0,Salmon Ahumado Fileteado 300 Gr,275.0,Ensalada Atun Con Mayonesa 135 Gr,18.0
89,Guanabana Gde 1 Kg,79.0,Champino Bco Entero 225Gr 225 Gr,24.0,Leche Uht Sabor Chocolate 200Ml 200 Ml,9.0,Arrachera Pollo Norteño 500 Gr,60.0,Sopa Knorr Sopa Coditos Mas Pasta 24X115G 115 Gr,16.5
90,Membrillo 1 Kg,62.0,Zanahoria Baby Bolthouse 340 Gr,35.0,Queso Singles 288 Gr,57.0,Arrachera Pollo Jalapeño 500 Gr,60.0,Frijoles Reffritos Peruanos 430 Gr,12.5
91,Yaka Yaka 1 Kg,41.0,Camote Morado 1 Kg,42.0,Queso Imitación Amarillo Rebanado 302 Gr,24.0,Arrachera De Pollo Adobada 700 Gr,193.0,Ensalada Campesina 400 Gr,13.9
92,Coco Rallado 1 Kg,133.0,Pepino Criollo 1 Kg,23.0,Bebida De Almendra Chocolate 190 Ml,13.0,Filete Empanizado Picante 700 Gr,152.0,Atun Premium En Agua 130 Gr,25.0
93,Chabacano 1 Kg,124.0,Hongo Cremini Baby 250 Gr,26.0,Queso Singles 144 Gr,29.0,Fajitas Pollo Practirico 500 Gr,72.0,Chiles Chipotles 215 Gr,21.0
94,Kumquat Njita Japonesa 1 Kg,19.5,Lechuga Hidroponica Mini Romaine,52.5,Leche Uht Selecta Deslactosada Leche Entera Ultr 1 Lt,24.0,Arrachera De Pavo Sabor Finas Hierbas 500 Gr,63.0,Frijoles Refritos Bayos 430 Gr,13.0
95,Cereza Clam 2 450 Gr,134.0,Chile Ancho 100Gr 100 Gr,26.0,Mantequilla Le Cordon Bleu 360 Gr,64.0,Filete De Tilapia Quinoa 500 Kg,115.0,Atun En Aceite De Oliva Pouch 74 Gr,28.0
96,Chicozapote 1 Kg,46.0,Mezcla De Floretes Brocoli/Zanahoria,32.9,Leche Condensada 380 Gr,18.0,Maíz Para Pozole 2 Kg,52.0,Ensalada De Verduras 440 Gr,13.9
97,Platano Morado Gde 1 Kg,31.0,Germinado De Soya A Granel 1 Kg,35.0,Yogurt Doble Cero Natural 1Kg Ypt 1 Kg,40.0,Heb Fajitas De Pollo Asadas Cocidas 737.08 Gr,147.0,Champiñones En Trozos En Lata 186 Gr,16.5
98,Ciruela Pasa 1 Kg,174.0,Pimiento Amarillo 1 Kg,93.0,Shot Jengibre Con Naranja Y Curcuma 90 Gr,20.9,Nuggets De Pollo Preformado 907.18 Gr,103.0,Sardinas De Tomate 425 Gr,43.0
99,Glaze De Fresa Pouch Bolsa 454 Gr,53.5,Heb Chile Cascabel 100G 100 Gr,26.0,Leche Uht Deslactosada Entera 1Lt 1 Lt,21.9,Tenders Tira De Pollo Preformados 907.18 Gr,103.0,Ensalada Campesina 220 Gr,8.0
100,Glaze P/Pie Fresa 454 Gr,65.9,Ajo Pelado En Blister,26.0,Bionda Requeson 500 Gr,77.9,Nuggets De Pollo Buffalo 680.4 Gr,143.0,Champiñones Rebanados En Lata 380 Gr,32.9
