,Frutas,Precio Frutas,Verdura,Precio Verduras,Lacteos,Precio Lacteos,Carne,Precio Carnes,Enlatados ,Precio Enlatados
0,Limón sin Semilla por Kg,26.9,Alcachofa Microwave 59g,144.9,Leche Alpura Clásica Pasteurizada 1L,20.4,Chuleta de Cerdo Ahumada kg,75.9,Chiles Habaneros Salsas Doña Jose en Escabeche 300g.,95.0
1,Plátano Chiapas por Kg,22.9,Esparrago Verde 454g,78.5,Frutal Fresa Alpura 250ml,7.5,Pierna de Cerdo Fresca con Hueso por kg,75.9,Rajas Rojas La Morena  210g,11.5
2,Naranja Arpilla5Kg,57.5,Tomate Cherry Glorys NatureSweet 283g,37.9,Frutal Durazno Alpura 250ml,7.5,Bistec Pulpa Blanca de Res kg,139.0,Rajas Verdes La Morena  2800g,99.8
3,Limón Eureka 1kg,57.9,Jitomate Hidrocool Cherry 380g,32.9,Frutal Piña-Coco Alpura 250ml,7.5,Medallón de Pechuga de Pollo The Farm Food kg,109.0,Chiles Clemente Jacques Chipotles Dulces Molidos 220g,15.5
4,Naranja de Jugo por Kg,14.9,Tomate Uva Cherubs NatureSweet 283g,37.9,Yoghurt Alpura Batido Fresa 125g,5.1,Camarón Cocido Pacotilla Premium 450g,199.0,"Chile Chipotle Lucero 270 gr, Escabeche",25.5
5,Toronja por Kg,15.9,Cebolla Perla Roja 10 283.4g,57.0,Yoghurt Alpura Batido Durazno 125g,5.1,Mariscada de Neptuno 500g,149.0,Chile Chipotle Lucero Adobo 520g,41.5
6,Limón Colima por Kg,31.0,Cebolla Perla Blanca 283.4g,57.0,Yoghurt Alpura Batido Mango 125g,5.1,Filete de Pescado Tilapia 600g,129.0,Chilitos Gueritos La Norteña Pouch 230g,21.0
7,Mandarina por Kg,32.9,Cebolla Perla Dorada 283.4g,57.0,Yoghurt Alpura Batido Manzana 125g,5.1,Filete de Pescado Basa Neptuno 600g,129.0,Chiles Serranos La Costeña Enteros en Escabeche 800g,36.9
8,Limade Chiche por Kg,41.0,Cebolla Amarillapor kg,29.9,Yoghurt Alpura Batido Zarzamora 125g,5.1,Filete de Salmón Neptuno 140g,99.9,Chiles El Mexicano Jalapeños en Nachos 380g,17.0
9,Naranja Paramount 1kg,58.5,Tomate Verde por kg,22.9,Yoghurt Alpura Batido Natural 125g,5.1,Filete de Pescado Marinado en Salsa de Cilantro 600g,147.0,Chiles El Mexicano Jalapeños en Rajas 800g,32.0
10,Mandarina Chumis Chica Bolsa 674 g,53.9,CebollínPieza,9.0,Yoghurt Alpura Batido Guayaba 125g,5.1,Filete Empanizado Neptuno 600g,129.0,Chiles El Mexicano Jalapeños en Rajas 340g,18.0
11,Pera Forelle Kg,134.7,Cebolla de Cambray por Pieza,9.9,Leche UHT Lala Yomi Fresa Slim 190 ml,5.5,Surimi En Barritas Neptuno 500g,79.0,Chiles El Mexicano Jalapeños en Rajas 220g,12.0
12,Cereza Domo 250g,74.9,Cebolla de Rabo por kg,32.0,Leche UHT Lala Yomi Vainilla 1L,23.5,Rib Eye Res Sonora Rancho el 17 por kg,579.0,Chiles Güeros Lol Tun Carricillos 350 gr,15.0
13,Kiwi Zespri Sungold 3 piezas,63.5,Tomatillo por kg,48.0,Leche UHT Lala Yomi Vainilla Slim 190 ml,5.5,Sirloin Res Sonora Rancho el 17 por kg,309.0,Chiles El Mexicano Jalapeños Enteros 780g,29.0
14,Pera Mantequilla por Kg,49.9,Aguacate Hass Enmallado pz,26.9,Leche UHT Lala Yomi Choco 1L,23.5,T-Bone Res Sonora Rancho el 17 por kg,339.0,Chiles El Mexicano Jalapeños Enteros 340g,16.0
15,Durazno Rojo por Kg,69.9,Cebolla Morada por kg,32.9,Leche UHT Lala Yomi Chocolate Slim 190 ml,5.5,Tira de Res Diezmillo Asado Sonora Rancho por kg,284.0,Chiles El Mexicano Chipotle Adobado 380g,30.0
16,Ciruela 1kg,79.9,Tomate Saladet por kg,12.9,Leche UHT Lala Yomi Fresa 1L,23.5,New York Res Sonora Rancho el 17por kg,524.0,Chiles El Mexicano Chipotle Adobado 215g,18.0
17,Nectarina por Kg,64.9,Cebolla Blanca por kg,13.5,Café con Lala UHT Deslactosado Slim 1L,27.0,Bistec de Res Sonora Rancho el 17 por kg,229.0,Chiles Nachos Jalapeños La Costeña Rodajas 380g,19.5
18,Pera Bosc por Kg,54.9,Aguacate Chiapas por Kg,39.9,Café con Lala UHT Deslactosada 330g,15.5,New York Choice Res por kg,499.0,Chiles Jalapeños La Costeña Picados 220g,12.8
19,Pera Asiática por Kg,69.9,Papa Blanca  por kg,36.9,Leche UHT Lala Yomi Chocolate 3 Pack Slim 190 ml,18.9,Rib Eye Choice Res kg,679.0,Jalapeños Nachos La Morena  210g,8.9
20,Kiwipor Kg,69.9,Tomate Bolapor kg,19.9,Leche UHT Lala Deslactosada Semi 6 Pack de 1L,115.0,Filete de Pescado Marinados en Salsa de Mezquite 600g,147.0,Chiles Nachos Jalapeños La Costeña Rodajas 800g,31.5
21,Durazno Amarillo por Kg,75.0,Papa Cambray por kg,32.9,Leche UHT Lala Deslactosada Baja en Grasa 6 Pack de 1L,114.0,Huevo San Juan Blanco 30 Piezas,67.0,Chiles Nachos Jalapeños La Costeña Rodajas 220g,11.5
22,Pera Roja Kg,64.9,Aguacate Hass por Kg,39.9,Leche UHT Lala Baja en Grasa 6 Pack de 1L,114.0,Molida de Res por kg,95.0,Chiles Jalapeños La Costeña Picados 380g,23.9
23,Pera Bartlett 1kg,52.9,Tomates Constellation NatureSweet 467g,69.9,Leche UHT Lala 100 Cacao Deslactosado 330ml,16.3,Milanesa de Pollo kg,154.0,Rajas San Marcos Verdes 380g,15.0
24,Ciruela Moscatel Kg,54.0,Coliflor Naranja 750g,99.0,Leche UHT Lala 100 sin lactosa Fresa 330ml,16.3,Pechuga de Pollo sin Hueso por kg,129.0,Chiles Clemente Jacques Jalapeños Rajas 380g,10.0
25,Manzana Jonagoldpor Kg,62.9,Santa MaríaPieza,8.82,Leche Lala 100 Semidescremada 1L,25.45,Filete de Salmón Pacifico por kg,349.0,Chiles Jalapeños La Costeña en Rajas 800g,26.5
26,Manzana Beaburn por kg,67.9,Pakchoypor Kg,55.5,Leche UHT Lala 100 sin lactosa Vainilla 330ml,16.3,Huevo Bachoco Blanco 30 Piezas,70.0,Chiles Jalapeños La Costeña en Rajas 105g,6.9
27,Manzana Royal Gala 1kg,39.9,Chalot Granel Kg,141.0,Alimento Líquido Lala Vita 3Nueces 960ml,36.3,Molida Selecta de Res kg,146.0,Chiles La Costeña Rajas Rojas de Jalapeño 220g,12.0
28,Manzana Royal Gala por Kg,49.9,Bouquet Hierbas Finas frescas Tiempo de Cosecha 50g,22.9,Leche Lala 100 sin Lactosa 1L,25.0,Filete de Tilapia por Kg,114.0,Rajas Verdes La Morena 265g,13.55
29,Manzana Granny Smithpor Kg,49.9,Alfalfa fresca Tiempo de Cosecha 50g,22.9,Alimento Líquido Lala Vita Amarant 960ml,36.3,Pechuga de Pollo Congelada sin Hueso por Kg,79.9,Chiles Jalapeños La Costeña en Rajas 340g,15.0
30,Manzana Golden Medianapor Kg,39.9,Estragón fresco Tiempo de Cosecha 50g,22.9,Leche UHT Lala Deslactosada Baja en Grasa 1.5L,30.3,Molida fina de Res 95/5 kg,172.0,Rajas Verdes La Morena  380g,18.9
31,Manzana Roja Medianapor Kg,36.9,Bouquet Garni frescas Tiempo de Cosecha 50g,22.9,Alimento Líquido Lala Vita UHT Proteína 330ml,21.5,Milanesa Pulpa Negra de Res kg,189.0,Chiles Clemente Jacques Jalapeños Rajas 220g,6.85
32,Manzana Golden Chica Bolsa por Kg,34.9,Bouquet Provence fresco Tiempo de Cosecha 50g,22.9,Leche UHT Lala Semi Deslactosada  1.5L,30.5,Milanesa Bola de Res kg,184.0,Rajas San Marcos verdes 255g,10.8
33,Manzana Roja Chica Bolsa por Kg,34.9,Árnica Infusiónate 40g,19.9,Leche UHT Lala Orgánica Entera 1L,29.5,Milanesa de Cerdo kg,96.0,Chiles Jalapeños La Costeña en Rajas 240g,11.85
34,Manzana Puré Harvest Golden 600g,18.9,Chícharo Fresh Garden Chino 365g,45.9,Leche Lala 100 sin Lactosa 1L,24.9,Huevos Blancos Chedraui 30 Piezas,62.5,Chiles Serranos La Costeña Enteros en Escabeche 220g,11.5
35,Manzana Chumis Gala Bolsa 613 g,29.9,Boldo Infusiónate 60g,26.9,Alimento Líquido Lala Vita Almendra 960ml,36.3,Pechuga Corte Americano de Pollo kg,70.0,Chiles Clemente Jacques Habaneros Rodajas Gourmet 220g,25.0
36,Manzana Chumis Golden Bolsa 552 g,31.9,Menta Infusiónate 45g,19.9,Alimento Líquido Lala Vita Coco 960 ml,36.3,Huevo Blanco El Calvario 30 Piezas,67.0,Chiles Serranos La Costeña Toreados en Rodajas 220g,14.9
37,Manzana Chumis Granny Bolsa 552 g,31.9,Coliflor Verde 750g,99.0,Leche Lala Orgánica Deslactosada UHT 1L,30.0,"Pollo, Entero kg",46.0,Zanahoria La Costeña en Escabeche 230g,9.2
38,Uva Sweet Carnival Clam 454g,53.0,GordoloboPieza,8.82,Alimento Líquido Lala Vita Arroz 960ml,36.3,Pierna de Pollo con Muslo Corte Americano por kg,34.0,Chiles Clemente Jacques Habaneros Molidos 220g,21.0
39,Uva Negra sin Semilla 1kg,89.9,Té de Limón Manojo por Pieza,5.2,Alimento Liquido Lala Vita UHT Chocolate 330ml,16.0,Bistec Pulpa Negra Res por kg,179.0,Chiles Serranos La Costeña Toreados 220g,16.9
40,Blue Berry Pieza,42.9,Ruda Pieza,4.4,Leche Lala 100 Reducida en Grasa 1L,26.25,Pulpa de Cerdo kg,88.0,Zanahorias en Escabeche Del Monte 390g,16.0
41,ZarzamoraPieza,39.9,HinojoPieza,8.5,Leche UHT Siluette Plus Deslactosada 960 ml,24.0,Bistec de Res kg,159.0,Chiles Jalapeños Rojos La Costeña Toreados en Rodajas 220g,15.0
42,Frambuesa Domo 170g,42.9,Col ChinaPieza,61.3,Leche UHT Lala Entera 1.5 L,28.7,Costilla de Cerdo kg,122.0,Jalapeños Hab Tun Escabeche Fsc 238Gr,20.5
43,Uva Verde 1kg,69.0,Col Morada por kg,39.0,Leche UHT Lala 100 Deslactosada 1L,26.5,Chambarete con Hueso de Res kg,124.0,Chiles Jalapeños La Costeña Enteros 780g,26.9
44,Uva Roja sin Semilla por Kg,59.0,Flor de Calabazapor kg,102.0,Leche Fresca Lala Entera 1L,20.5,Pechuga de Pollo con Hueso Light  por Kg,114.0,Jalapeños San Marcos Enteros 380g,11.5
45,Uva GloboEmperador por kg,69.0,Verdolaga por kg,24.5,Leche Fresca Lala Entera 1.80L,33.5,Huevo San Juan Blanco 18 Piezas,43.5,Chiles Jalapeños La Costeña Enteros 240g,16.35
46,Fresa Pieza,59.9,Col Bruselas por kg,60.0,Leche Lala 100 Deslactosada 1L,25.6,Arrachera Sukarne de Res 600g,164.0,Jalapeños San Marcos Enteros 780g,23.5
47,Arándano Natural Fresco Clamshell 200 g,49.9,Raíz de Azafrán por kg,39.3,Leche Fresca Lala Entera 1L,20.5,Huevo Bachoco Blanco 18 Piezas,45.0,Jalapeño La Morena 800g,28.0
48,Sandia Personal kg,20.5,Jengibrepor kg,119.0,Leche Fresca Lala Entera 1 Galón,67.0,Chuleta de Cerdo Natural kg,90.0,Chiles Jalapeños La Costeña Enteros 340g,14.9
49,Plátano Macho por Kg,29.9,Colinabo Rollo,19.33,Leche Lala Orgánica Pasteurizada 1L,27.0,Molida Mixta Res con Cerdo por kg,134.0,Jalapeño La Morena 380g,14.9
50,Plátano Dominico por Kg,35.0,Poro Pieza,19.8,Leche Lala 100 Fresca sin Lactosa Light 1L,26.2,Pechuga de Pollo con Hueso Anatómico Fresco por Kg,90.0,Jalapeños La Morena 265g,11.5
51,Coco por Pieza,19.0,Rábano Cambray Pieza,10.6,Leche Lala 100 Semidescremada 330ml,12.2,Huevos Blancos Tehuacan 30 Piezas,63.0,Chiles Clemente Jacques Jalapeños Enteros 380g,10.0
52,Guayaba por Kg,36.9,Hoja Santa Rollo,12.0,Leche Lala 100 Fresca Semidescremada 1L,27.5,Pierna de Cerdo Congelada sin Hueso por kg,66.0,Jalapeños San Marcos Enteros 255g,8.5
53,Sandia Blanca Rayadapor Kg,13.9,Huazontle Rollo,19.0,Leche Fresca Lala Deslactosada 2% 1.80L,33.5,Codillo Chamorro de Cerdo por kg,62.0,Chiles Clemente Jacques Chipotles Dulces Gourmet 220g,25.9
54,Melón Chino por Kg,21.9,Manzanilla Rollo,11.6,Leche Fresca Lala Deslactosada Semi 1.80 L,36.9,Carne Molida de Pierna de Cerdo por kg,94.0,Chipotles Adobo La Morena  380g,33.0
55,Papaya Maradolpor kg,22.9,Hierbas de OlorPieza,12.3,Leche Fresca Lala Deslactosada Semi 1L,22.2,Lomo de Cerdo por kg,109.0,Chipotles San Marcos Molidos 215g,17.5
56,Piña Gota Mielpor Kg,19.9,Hierba Buena Rollo,7.9,Leche Fresca Lala Light Baja Grasa 1.80L,33.5,Clara Huevo Liquida Pasteurizada,44.5,Chipotles San Marcos en Escabeche 215g,17.5
57,Melón Amarillopor Kg,19.0,Berros Rollo,15.0,Leche Lala 100 Fresca Light 1L,27.5,Filete Basa Blanco por kg,84.9,Chiles Clemente Jacques Chipotles 220g,14.7
58,Mango Ataulfopor Kg,42.9,Espinacas Rollo,7.8,Leche Fresca Lala Light Baja en Grasa 1L,19.0,Huevo Bachoco Blanco 12 Piezas,31.5,Chiles Chipotles La Costeña Adobados 380g,36.9
59,Mango Manilapor Kg,39.9,Perejil Chino Rollo,13.0,Leche Lala 100 Fresca sin Lactosa Semi 1L,26.2,Huevos Blancos Tehuacan 18 Piezas,40.0,Chiles Chipotles La Costeña Adobados 105g,9.9
60,Mango Paraíso por Kg,36.9,Epazote Rollo,11.6,Leche Fresca Lala Light Baja Grasa 1 Galón,67.0,Cecina Especial Pulpa Negra de Res kg,204.0,Chiles Chipotles La Costeña Adobados Picados 220g,22.5
61,Mango Oro por Kg,26.9,Salvia Manojo,12.5,Leche Fresca Lala Light Baja en Grasa 1L,20.5,Retazo con Hueso para Caldo de Res por kg,89.0,Chipotles San Marcos Adobados Enteros 255g,19.5
62,Kiwi Chumis Verde Bolsa 450 g,47.9,Cilantro Rollo,6.4,Leche UHT Lala Semidescremada 1L,20.3,Arrachera Ligera Sukarne de Res 600g,164.0,Chipotles Adobo La Morena 265g,23.35
63,Ponche de Frutas 200 Gr Frutezanas,21.5,Albahaca Rollo,16.0,Leche UHT Lala Light 1 L,20.35,Filete Basa Rojo por kg,79.9,Chipotles San Marcos Adobados Enteros 380g,24.5
64,Carambola Granel Kg,51.0,Hoja de Plátano Pieza,19.9,Leche UHT Lala Entera 1L,19.65,Carne Deshebrada Sukarne de Res 300g,84.0,Chiles Chilpotles Del Monte Adobados 205g,18.7
65,Calabaza Martinez and Sons Baby Italian 340g,64.9,Col Blanca por kg,14.9,Leche UHT Lala Semidescremada 6  Pack de 1 L,114.0,Huevo Crio Blanco Emplayado 30 Piezas,69.9,Chiles Chipotles La Costeña Adobados 220g,19.8
66,Calabaza Martinez and Sons Baby Estrella Amarilla 340g,64.9,Ejote por kg,49.9,Leche UHT Lala Entera 6 Pack de 1 L,114.0,Huevo San Juan Blanco 12 Piezas,29.5,Rajas San Marcos verdes 120g,6.5
67,Calabaza Martinez and Sons Baby Estrella Verde 340g,34.9,Chícharo por kg,59.4,Producto Lácteo UHT Más Entera 3 Piezas,39.55,Milanesa empanizada de cerdo kg,88.9,Chipotles San Marcos Adobados Enteros 120g,9.4
68,Zanahoria Martinez and Sons Baby Mixta 340g,64.9,Chayote sin Espinas por kg,29.5,Producto Lácteo Marsella Deslactosada 1L,15.7,Milanesa empanizada de res kg,124.0,Chipotle San Marcos Escabeche  380g,37.5
69,Betabel Martinez and Sons Baby Mixto 454g,64.9,Betabel por Kg,21.9,Alimento Lácteo Chairel UHT 1L,11.7,Pierna de Cerdo Horneada Mechada por Kg,164.0,Chiles Carey Rajas Verdes de Jalapeño en Escabeche 380g,12.9
70,Betabel Martinez and Sons Baby Rojo Pelado 340g,64.9,Brócoli por Kg,29.9,Formula Láctea Marsella Ultrapasteurizada 1L,13.1,Rib Eye Wagyu Americano por kg,1919.0,Chiles Carey Rajas Verdes de Jalapeño en Escabeche 800g,25.9
